{
  "$schema": "https://json-schema.org/draft/2020-12/schema",
  "$id": "dialogue.schema.json",
  "title": "Reval Rebel dialogue tree content",
  "type": "object",
  "additionalProperties": false,
  "required": [
    "type",
    "id",
    "title",
    "confidence",
    "canon_status",
    "approval",
    "deterministic_offline",
    "participants",
    "start_node_id",
    "nodes",
    "source_notes"
  ],
  "properties": {
    "type": {
      "const": "dialogue"
    },
    "id": {
      "$ref": "common.schema.json#/$defs/content_id"
    },
    "title": {
      "type": "string",
      "minLength": 1
    },
    "confidence": {
      "$ref": "common.schema.json#/$defs/confidence_label"
    },
    "canon_status": {
      "$ref": "common.schema.json#/$defs/canon_status"
    },
    "approval": {
      "$ref": "common.schema.json#/$defs/review_record"
    },
    "deterministic_offline": {
      "$ref": "common.schema.json#/$defs/deterministic_offline"
    },
    "participants": {
      "type": "array",
      "minItems": 1,
      "items": {
        "$ref": "common.schema.json#/$defs/content_id"
      }
    },
    "start_node_id": {
      "$ref": "common.schema.json#/$defs/local_id"
    },
    "entry_variants": {
      "type": "array",
      "minItems": 1,
      "items": {
        "type": "object",
        "additionalProperties": false,
        "required": [
          "node_id"
        ],
        "properties": {
          "node_id": {
            "$ref": "common.schema.json#/$defs/local_id"
          },
          "priority": {
            "type": "integer"
          },
          "conditions": {
            "type": "array",
            "items": {
              "$ref": "common.schema.json#/$defs/condition"
            }
          }
        }
      }
    },
    "word_count_estimate": {
      "type": "integer",
      "minimum": 0,
      "maximum": 2500
    },
    "nodes": {
      "type": "array",
      "minItems": 1,
      "items": {
        "type": "object",
        "additionalProperties": false,
        "required": [
          "id"
        ],
        "properties": {
          "id": {
            "$ref": "common.schema.json#/$defs/local_id"
          },
          "speaker_id": {
            "$ref": "common.schema.json#/$defs/content_id"
          },
          "text": {
            "type": "string",
            "minLength": 1
          },
          "text_key": {
            "type": "string",
            "minLength": 1
          },
          "conditions": {
            "type": "array",
            "items": {
              "$ref": "common.schema.json#/$defs/condition"
            }
          },
          "effects": {
            "type": "array",
            "items": {
              "$ref": "common.schema.json#/$defs/effect"
            }
          },
          "once": {
            "type": "boolean"
          },
          "next_node_id": {
            "$ref": "common.schema.json#/$defs/local_id"
          },
          "choices": {
            "type": "array",
            "maxItems": 4,
            "items": {
              "type": "object",
              "additionalProperties": false,
              "required": [
                "id",
                "target_node_id"
              ],
              "properties": {
                "id": {
                  "$ref": "common.schema.json#/$defs/local_id"
                },
                "text": {
                  "type": "string",
                  "minLength": 1
                },
                "text_key": {
                  "type": "string",
                  "minLength": 1
                },
                "target_node_id": {
                  "$ref": "common.schema.json#/$defs/local_id"
                },
                "conditions": {
                  "type": "array",
                  "items": {
                    "$ref": "common.schema.json#/$defs/condition"
                  }
                },
                "disabled_reason": {
                  "type": "string"
                },
                "effects": {
                  "type": "array",
                  "items": {
                    "$ref": "common.schema.json#/$defs/effect"
                  }
                },
                "move": {
                  "$ref": "common.schema.json#/$defs/duel_move"
                },
                "spell_id": {
                  "type": "string",
                  "pattern": "^(spell|rite)\\.[a-z0-9_.]+$",
                  "description": "Duel replies only: casting this granted spell or rite IS the reply; `text` is the spoken line that voices the cast."
                },
                "voice_path": {
                  "type": "string",
                  "pattern": "^res://.+\\.(ogg|wav|mp3)$",
                  "description": "Optional offline voice clip for the choice's spoken line; the spirit arena plays it on the Voice bus when the reply is cast and voice playback is on."
                },
                "comprehension": {
                  "type": "object",
                  "additionalProperties": false,
                  "required": [
                    "language",
                    "min_tier"
                  ],
                  "properties": {
                    "language": {
                      "enum": [
                        "lang.estonian",
                        "lang.german",
                        "lang.latin",
                        "lang.russian",
                        "lang.danish"
                      ]
                    },
                    "min_tier": {
                      "type": "integer",
                      "minimum": 1,
                      "maximum": 3
                    }
                  }
                }
              }
            }
          },
          "move": {
            "$ref": "common.schema.json#/$defs/duel_move"
          },
          "language": {
            "enum": [
              "lang.estonian",
              "lang.german",
              "lang.latin",
              "lang.russian",
              "lang.danish"
            ]
          },
          "gist": {
            "type": "string",
            "minLength": 1
          },
          "imagery": {
            "type": "string",
            "minLength": 1
          }
        }
      }
    },
    "source_notes": {
      "type": "array",
      "minItems": 1,
      "items": {
        "$ref": "common.schema.json#/$defs/source_note"
      }
    },
    "duel": {
      "type": "object",
      "additionalProperties": false,
      "required": [
        "stakes",
        "resolution_node_ids"
      ],
      "properties": {
        "stakes": {
          "type": "array",
          "minItems": 1,
          "uniqueItems": true,
          "items": {
            "$ref": "common.schema.json#/$defs/duel_stake"
          }
        },
        "resolution_node_ids": {
          "type": "array",
          "minItems": 1,
          "uniqueItems": true,
          "items": {
            "$ref": "common.schema.json#/$defs/local_id"
          }
        },
        "temperament": {
          "type": "array",
          "uniqueItems": true,
          "items": {
            "enum": [
              "impulsive",
              "procrastinator",
              "creative",
              "proud",
              "anxious"
            ]
          }
        },
        "topic": {
          "type": "object",
          "additionalProperties": false,
          "required": [
            "id",
            "tags",
            "lines"
          ],
          "properties": {
            "id": {
              "$ref": "common.schema.json#/$defs/local_id"
            },
            "tags": {
              "type": "array",
              "minItems": 1,
              "uniqueItems": true,
              "items": {
                "$ref": "common.schema.json#/$defs/local_id"
              }
            },
            "lines": {
              "type": "object",
              "additionalProperties": false,
              "minProperties": 1,
              "properties": {
                "fear": {
                  "type": "array",
                  "minItems": 1,
                  "items": {
                    "type": "object",
                    "additionalProperties": false,
                    "required": [
                      "text",
                      "relevance"
                    ],
                    "properties": {
                      "text": {
                        "type": "string",
                        "minLength": 1
                      },
                      "relevance": {
                        "type": "array",
                        "minItems": 1,
                        "uniqueItems": true,
                        "items": {
                          "$ref": "common.schema.json#/$defs/local_id"
                        }
                      }
                    }
                  }
                },
                "shame": {
                  "type": "array",
                  "minItems": 1,
                  "items": {
                    "type": "object",
                    "additionalProperties": false,
                    "required": [
                      "text",
                      "relevance"
                    ],
                    "properties": {
                      "text": {
                        "type": "string",
                        "minLength": 1
                      },
                      "relevance": {
                        "type": "array",
                        "minItems": 1,
                        "uniqueItems": true,
                        "items": {
                          "$ref": "common.schema.json#/$defs/local_id"
                        }
                      }
                    }
                  }
                },
                "duty": {
                  "type": "array",
                  "minItems": 1,
                  "items": {
                    "type": "object",
                    "additionalProperties": false,
                    "required": [
                      "text",
                      "relevance"
                    ],
                    "properties": {
                      "text": {
                        "type": "string",
                        "minLength": 1
                      },
                      "relevance": {
                        "type": "array",
                        "minItems": 1,
                        "uniqueItems": true,
                        "items": {
                          "$ref": "common.schema.json#/$defs/local_id"
                        }
                      }
                    }
                  }
                },
                "love": {
                  "type": "array",
                  "minItems": 1,
                  "items": {
                    "type": "object",
                    "additionalProperties": false,
                    "required": [
                      "text",
                      "relevance"
                    ],
                    "properties": {
                      "text": {
                        "type": "string",
                        "minLength": 1
                      },
                      "relevance": {
                        "type": "array",
                        "minItems": 1,
                        "uniqueItems": true,
                        "items": {
                          "$ref": "common.schema.json#/$defs/local_id"
                        }
                      }
                    }
                  }
                },
                "faith": {
                  "type": "array",
                  "minItems": 1,
                  "items": {
                    "type": "object",
                    "additionalProperties": false,
                    "required": [
                      "text",
                      "relevance"
                    ],
                    "properties": {
                      "text": {
                        "type": "string",
                        "minLength": 1
                      },
                      "relevance": {
                        "type": "array",
                        "minItems": 1,
                        "uniqueItems": true,
                        "items": {
                          "$ref": "common.schema.json#/$defs/local_id"
                        }
                      }
                    }
                  }
                },
                "coin": {
                  "type": "array",
                  "minItems": 1,
                  "items": {
                    "type": "object",
                    "additionalProperties": false,
                    "required": [
                      "text",
                      "relevance"
                    ],
                    "properties": {
                      "text": {
                        "type": "string",
                        "minLength": 1
                      },
                      "relevance": {
                        "type": "array",
                        "minItems": 1,
                        "uniqueItems": true,
                        "items": {
                          "$ref": "common.schema.json#/$defs/local_id"
                        }
                      }
                    }
                  }
                }
              }
            }
          }
        }
      }
    }
  }
}
