{
  "type": "dialogue",
  "id": "dialogue.bell_and_chain.inspect_patrol",
  "title": "The Bell and the Chain - Patrol rotation log",
  "confidence": "invented",
  "canon_status": "draft",
  "approval": {
    "status": "draft",
    "reviewer": "P4-002"
  },
  "deterministic_offline": {
    "authored": true,
    "runtime_llm_allowed": false,
    "free_text_input_allowed": false,
    "selection": "explicit_node_id"
  },
  "participants": [
    "char.kalev"
  ],
  "start_node_id": "inspect_patrol",
  "nodes": [
    {
      "id": "inspect_patrol",
      "speaker_id": "char.kalev",
      "text": "Henning doubled east-wall patrols after curfew. The failed alarm test spooked the watch.",
      "effects": [
        {
          "op": "set_fact",
          "key": "fact.bell_and_chain.patrol_rotation",
          "value": true
        }
      ]
    }
  ],
  "source_notes": [
    {
      "confidence": "invented",
      "summary": "Patrol rotation log inspection for The Bell and the Chain investigation loop.",
      "citations": [
        "docs/SCENES/the-bell-and-the-chain.md"
      ]
    }
  ]
}
