{
  "type": "dialogue",
  "id": "dialogue.prologue.kalev_arrives",
  "title": "Kalev takes the apprentice",
  "confidence": "invented",
  "canon_status": "draft",
  "approval": {
    "status": "draft",
    "notes": "SD-05 prologue prototype (ADR 0033)."
  },
  "deterministic_offline": {
    "authored": true,
    "runtime_llm_allowed": false,
    "free_text_input_allowed": false,
    "selection": "explicit_node_id"
  },
  "participants": [
    "char.kalev",
    "char.apprentice"
  ],
  "start_node_id": "kalev_looks",
  "entry_variants": [
    {
      "node_id": "kalev_heard_struck",
      "priority": 30,
      "conditions": [
        {
          "op": "flag_is",
          "key": "flag.prologue.struck_porter",
          "value": true
        }
      ]
    },
    {
      "node_id": "kalev_heard_broke",
      "priority": 20,
      "conditions": [
        {
          "op": "flag_is",
          "key": "flag.prologue.broke_porter",
          "value": true
        }
      ]
    },
    {
      "node_id": "kalev_heard_punished",
      "priority": 10,
      "conditions": [
        {
          "op": "flag_is",
          "key": "flag.prologue.punished_by_porter",
          "value": true
        }
      ]
    }
  ],
  "nodes": [
    {
      "id": "kalev_heard_struck",
      "speaker_id": "char.kalev",
      "text": "You laid hands on the porter under my roof. I have a temper too, boy. It has cost me more than it ever won me.",
      "next_node_id": "kalev_looks"
    },
    {
      "id": "kalev_heard_broke",
      "speaker_id": "char.kalev",
      "text": "Hanß went out of my door white as flour, and he will not say what you said to him. Remember that words cut too.",
      "next_node_id": "kalev_looks"
    },
    {
      "id": "kalev_heard_punished",
      "speaker_id": "char.kalev",
      "text": "Show me the hand. The rod, for a loaf. Keep it out of the fire until it heals.",
      "next_node_id": "kalev_looks"
    },
    {
      "id": "kalev_looks",
      "speaker_id": "char.kalev",
      "text": "My apprentice has gone, and the forge will not stoke itself. Can you carry iron, boy?",
      "next_node_id": "kalev_offer",
      "choices": [
        {
          "id": "yes",
          "text": "Yes.",
          "target_node_id": "kalev_offer"
        },
        {
          "id": "stare",
          "text": "[Say nothing, and watch him]",
          "target_node_id": "kalev_offer"
        }
      ]
    },
    {
      "id": "kalev_offer",
      "speaker_id": "char.kalev",
      "text": "A bed by the hearth and bread twice a day. Work from before light. Come.",
      "effects": [
        {
          "op": "set_flag",
          "key": "flag.prologue.apprenticed",
          "value": true
        }
      ]
    }
  ],
  "source_notes": [
    {
      "confidence": "plausible composite",
      "summary": "Almshouse life tied to the Holy Spirit parish; dialogue is invented for ADR 0033."
    }
  ]
}
