{
  "type": "dialogue",
  "id": "dialogue.bitter_brew.brewery_monopolized",
  "title": "A Bitter Brew - Contract brewery aftermath",
  "confidence": "invented",
  "canon_status": "draft",
  "approval": {
    "status": "draft",
    "reviewer": "P2-010"
  },
  "deterministic_offline": {
    "authored": true,
    "runtime_llm_allowed": false,
    "free_text_input_allowed": false,
    "selection": "explicit_node_id"
  },
  "participants": [
    "char.kalev"
  ],
  "start_node_id": "brewery_contract",
  "word_count_estimate": 38,
  "nodes": [
    {
      "id": "brewery_contract",
      "speaker_id": "char.kalev",
      "text": "Jürgen's contract banner hangs over the yard. The ale still flows, but every barrel leaves under his tally and Aita tends his vats."
    }
  ],
  "source_notes": [
    {
      "confidence": "invented",
      "summary": "Visible brewery state after the monopolized aftermath.",
      "citations": [
        "docs/SCENES/a-bitter-brew.md"
      ]
    }
  ]
}
